{
  "note": "Classification and schema binding for every tracked JSON data file. The schema-required gate rejects unclassified files.",
  "kinds": {
    "declaration": "Hand-authored. Code reads it as truth. A schema is required.",
    "store": "Machine-written state this repo reads back. A schema is required: we control both ends.",
    "feed": "Downloaded from upstream. A schema is optional — the shape is the publisher's."
  },
  "entries": [
    {
      "path": "bin/bare-catch-baseline.json",
      "kind": "store",
      "schema": "schema/bare-catch-baseline.schema.json",
      "binding": "mirrored"
    },
    {
      "path": "bin/comment-baseline.json",
      "kind": "store",
      "schema": "schema/comment-baseline.schema.json",
      "binding": "mirrored"
    },
    {
      "path": "cra/controls.json",
      "kind": "declaration",
      "schema": "schema/cra-controls.schema.json",
      "binding": "mirrored"
    },
    {
      "path": "cra/csirt-directory.json",
      "kind": "declaration",
      "schema": "schema/csirt-directory.schema.json",
      "binding": "mirrored"
    },
    {
      "path": "cra/cwe-catalogue.json",
      "kind": "feed",
      "schema": null,
      "reason": "Vendored MITRE CWE 4.20 feed; its published content is upstream-owned. Wrapper metadata remains local schema debt."
    },
    {
      "path": "cra/products.example.json",
      "kind": "declaration",
      "schema": "schema/product.schema.json",
      "binding": "none",
      "note": "Synthetic example of the private product registry; bin/test/schema-required.test.mjs validates it."
    },
    {
      "path": "lib/claude-mcp-none.json",
      "kind": "declaration",
      "schema": "schema/claude-mcp-none.schema.json",
      "binding": "none"
    },
    {
      "path": "lib/memory-layer-contract.json",
      "kind": "declaration",
      "schema": "schema/memory-layer-contract.schema.json",
      "binding": "mirrored"
    },
    {
      "path": "manifests/agent-surface.json",
      "kind": "declaration",
      "schema": "schema/agent-surface.schema.json",
      "binding": "validator"
    },
    {
      "path": "manifests/feature-charter.json",
      "kind": "declaration",
      "schema": "schema/feature-charter.schema.json",
      "binding": "none",
      "note": "bin/feature-census.mjs reads it and checks only that groups is an array and that no (surface, key) is claimed twice; the schema is not applied at runtime yet."
    },
    {
      "path": "manifests/formats.json",
      "kind": "declaration",
      "schema": "schema/formats.schema.json",
      "binding": "none",
      "note": "Read only by bin/test/format-freeze.test.mjs, which validates it and holds each format's writer and schema to it."
    },
    {
      "path": "manifests/eol-snapshot.json",
      "kind": "feed",
      "schema": null,
      "reason": "endoflife.date release cycles, compacted to cycle, eol and codename by bin/eol-snapshot.mjs. The dates are the publisher's; bin/eol-scan.mjs reads those three fields and lists a version it cannot place as undetermined."
    },
    {
      "path": "manifests/bola/example.json",
      "kind": "declaration",
      "schema": "schema/bola-manifest.schema.json",
      "binding": "mirrored",
      "note": "Synthetic example; operator manifests are private records in monitor/private/bola/ (CW_BOLA_MANIFEST_DIR)."
    },
    {
      "path": "monitor/private/branch-protection.json",
      "kind": "declaration",
      "schema": "schema/branch-protection.schema.json",
      "binding": "none"
    },
    {
      "path": "manifests/branch-protection.example.json",
      "kind": "declaration",
      "schema": "schema/branch-protection.schema.json",
      "binding": "none",
      "note": "Synthetic example of the private record read by bin/commit-provenance.mjs and bin/verify-branch-protection.mjs; bin/test/schema-required.test.mjs validates it. Neither consumer applies the schema at runtime."
    },
    {
      "path": "manifests/build-health.json",
      "kind": "declaration",
      "schema": "schema/manifest.schema.json",
      "binding": "none"
    },
    {
      "path": "manifests/gradle-distributions.json",
      "kind": "declaration",
      "schema": "schema/gradle-distributions.schema.json",
      "binding": "none"
    },
    {
      "path": "manifests/install-catalog.json",
      "kind": "declaration",
      "schema": "schema/manifest.schema.json",
      "binding": "none"
    },
    {
      "path": "manifests/jvm-egress-allowlist.json",
      "kind": "declaration",
      "schema": "schema/jvm-egress-allowlist.schema.json",
      "binding": "mirrored"
    },
    {
      "path": "manifests/launchlist.json",
      "kind": "declaration",
      "schema": "schema/launchlist.schema.json",
      "binding": "validator"
    },
    {
      "path": "manifests/llm-hosts.json",
      "kind": "declaration",
      "schema": "schema/llm-hosts.schema.json",
      "binding": "validator"
    },
    {
      "path": "manifests/quality-gates.json",
      "kind": "declaration",
      "schema": "schema/manifest.schema.json",
      "binding": "none"
    },
    {
      "path": "manifests/runtime.json",
      "kind": "declaration",
      "schema": "schema/manifest.schema.json",
      "binding": "none"
    },
    {
      "path": "manifests/scanner-quirks.json",
      "kind": "declaration",
      "schema": "schema/scanner-quirks.schema.json",
      "binding": "mirrored"
    },
    {
      "path": "manifests/security-baseline.json",
      "kind": "declaration",
      "schema": "schema/manifest.schema.json",
      "binding": "none"
    },
    {
      "path": "manifests/security-baseline.map.json",
      "kind": "store",
      "schema": "schema/manifest-map.schema.json",
      "binding": "mirrored",
      "note": "Generated by bin/manifest-map.mjs; --check compares it byte-for-byte against a regeneration, which subsumes shape validation."
    },
    {
      "path": "manifests/security-tools.json",
      "kind": "declaration",
      "schema": "schema/manifest.schema.json",
      "binding": "none"
    },
    {
      "path": "manifests/tool-pins.json",
      "kind": "declaration",
      "schema": "schema/tool-pins.schema.json",
      "binding": "validator"
    },
    {
      "path": "manifests/upstream-sources.json",
      "kind": "declaration",
      "schema": "schema/upstream-sources.schema.json",
      "binding": "none"
    },
    {
      "path": "manifests/yara-rules.json",
      "kind": "declaration",
      "schema": "schema/yara-rules.schema.json",
      "binding": "mirrored"
    },
    {
      "path": "manifests/wire-layer.json",
      "kind": "declaration",
      "schema": "schema/wire-layer.schema.json",
      "binding": "validator"
    },
    {
      "path": "monitor/annotations.example.json",
      "kind": "store",
      "schema": "schema/annotation.schema.json",
      "binding": "none",
      "note": "Synthetic example of the private record; bin/test/schema-required.test.mjs validates it."
    },
    {
      "path": "monitor/approach-taxonomy-baseline.json",
      "kind": "store",
      "binding": "mirrored",
      "schema": "schema/approach-taxonomy-baseline.schema.json"
    },
    {
      "path": "monitor/approach-taxonomy.json",
      "kind": "declaration",
      "schema": "schema/approach-taxonomy.schema.json",
      "binding": "mirrored"
    },
    {
      "path": "monitor/bind-declarations.json",
      "kind": "declaration",
      "schema": "schema/bind-declarations.schema.json",
      "binding": "validator"
    },
    {
      "path": "monitor/config-correctness-ledger.example.json",
      "kind": "store",
      "schema": "schema/config-correctness-ledger.schema.json",
      "binding": "none",
      "note": "Synthetic example of the private record; bin/test/schema-required.test.mjs validates it."
    },
    {
      "path": "monitor/release-terms.example.json",
      "kind": "declaration",
      "schema": "schema/release-terms.schema.json",
      "binding": "validator",
      "note": "The shape of the private denied-term list; loadTerms() in bin/lib/release-terms.mjs validates the real list against the schema before compiling it."
    },
    {
      "path": "monitor/credential-scope.example.json",
      "kind": "declaration",
      "schema": "schema/credential-scope.schema.json",
      "binding": "none",
      "note": "Commitwork's own integration credentials as the example; bin/test/schema-required.test.mjs validates it."
    },
    {
      "path": "monitor/data/advisory-cvss.json",
      "kind": "feed",
      "schema": null,
      "reason": "Upstream feed. The shape is the publisher's, not ours; a schema here would assert control we do not have. Extractors fail closed on a shape they cannot read."
    },
    {
      "path": "monitor/data/attack-graph.json",
      "kind": "store",
      "schema": "schema/attack-graph.schema.json",
      "binding": "validator"
    },
    {
      "path": "monitor/data/capec-graph.json",
      "kind": "feed",
      "schema": null,
      "reason": "Upstream feed. The shape is the publisher's, not ours; a schema here would assert control we do not have. Extractors fail closed on a shape they cannot read."
    },
    {
      "path": "monitor/data/cwe-graph.json",
      "kind": "feed",
      "schema": null,
      "reason": "Upstream feed. The shape is the publisher's, not ours; a schema here would assert control we do not have. Extractors fail closed on a shape they cannot read."
    },
    {
      "path": "monitor/data/epss.json",
      "kind": "feed",
      "schema": null,
      "reason": "Upstream feed. The shape is the publisher's, not ours; a schema here would assert control we do not have. Extractors fail closed on a shape they cannot read."
    },
    {
      "path": "monitor/data/kev.json",
      "kind": "feed",
      "schema": null,